### ISSUE TITLE
Issue with asp.net core and SSL

### ISSUE THREAD

**Issue by davidelettieri** [Azure/service-fabric-aspnetcore#75]
I got the following exception randomly when calling the asp.net core web api hosted in a service fabric production environment. The app is targeting .net core 2.2

What can I do to troubleshoot this issue?

>System.IO.IOException:
   at System.Net.Security.SslState.StartReadFrame (System.Net.Security, Version=4.1.1.0, Culture=neutral, PublicKeyToken=b03f5f7f11d50a3a)
   at System.Net.Security.SslState.PartialFrameCallback (System.Net.Security, Version=4.1.1.0, Culture=neutral, PublicKeyToken=b03f5f7f11d50a3a)
   at System.Runtime.ExceptionServices.ExceptionDispatchInfo.Throw (System.Private.CoreLib, Version=4.0.0.0, Culture=neutral, PublicKeyToken=7cec85d7bea7798e)
   at System.Net.Security.SslState.ThrowIfExceptional (System.Net.Security, Version=4.1.1.0, Culture=neutral, PublicKeyToken=b03f5f7f11d50a3a)
   at System.Net.Security.SslState.InternalEndProcessAuthentication (System.Net.Security, Version=4.1.1.0, Culture=neutral, PublicKeyToken=b03f5f7f11d50a3a)
   at System.Net.Security.SslState.EndProcessAuthentication (System.Net.Security, Version=4.1.1.0, Culture=neutral, PublicKeyToken=b03f5f7f11d50a3a)
   at System.Net.Security.SslStream.EndAuthenticateAsServer (System.Net.Security, Version=4.1.1.0, Culture=neutral, PublicKeyToken=b03f5f7f11d50a3a)
   at System.Net.Security.SslStream+<>c.<AuthenticateAsServerAsync>b__51_1 (System.Net.Security, Version=4.1.1.0, Culture=neutral, PublicKeyToken=b03f5f7f11d50a3a)
   at System.Threading.Tasks.TaskFactory`1.FromAsyncCoreLogic (System.Private.CoreLib, Version=4.0.0.0, Culture=neutral, PublicKeyToken=7cec85d7bea7798e)
   at System.Runtime.ExceptionServices.ExceptionDispatchInfo.Throw (System.Private.CoreLib, Version=4.0.0.0, Culture=neutral, PublicKeyToken=7cec85d7bea7798e)
   at System.Runtime.CompilerServices.TaskAwaiter.HandleNonSuccessAndDebuggerNotification (System.Private.CoreLib, Version=4.0.0.0, Culture=neutral, PublicKeyToken=7cec85d7bea7798e)
   at Microsoft.AspNetCore.Server.Kestrel.Https.Internal.HttpsConnectionAdapter+<InnerOnConnectionAsync>d__10.MoveNext (Microsoft.AspNetCore.Server.Kestrel.Core, Version=2.2.0.0, Culture=neutral, PublicKeyToken=adb9793829ddae60)

Google Chrome reports "ERR_SSL_PROTOCOL_ERROR" and "ERR_SSL_VERSION_INTERFERENCE" 

WireShark trace with some successes and some failures, the client seems to negotiate tlsv1 instead of tlsv1.2

|No.|Time|Source|Destination|Protocol|Length|Info|
|---|----|------|-----------|--------|------|----|
|1|0.000000|A|B|TCP|66|57598  >  20000 [SYN] Seq=0 Win=64240 Len=0 MSS=1460 WS=256 SACK_PERM=1|
|2|0.000091|A|B|TCP|66|57599  >  20000 [SYN] Seq=0 Win=64240 Len=0 MSS=1460 WS=256 SACK_PERM=1|
|3|0.000162|A|B|TCP|66|57600  >  20000 [SYN] Seq=0 Win=64240 Len=0 MSS=1460 WS=256 SACK_PERM=1|
|4|0.000226|A|B|TCP|66|57601  >  20000 [SYN] Seq=0 Win=64240 Len=0 MSS=1460 WS=256 SACK_PERM=1|
|5|0.000291|A|B|TCP|66|57602  >  20000 [SYN] Seq=0 Win=64240 Len=0 MSS=1460 WS=256 SACK_PERM=1|
|6|0.000359|A|B|TCP|66|57603  >  20000 [SYN] Seq=0 Win=64240 Len=0 MSS=1460 WS=256 SACK_PERM=1|
|7|0.029557|B|A|TCP|66|20000  >  57598 [SYN, ACK] Seq=0 Ack=1 Win=8192 Len=0 MSS=1440 WS=256 SACK_PERM=1|
|8|0.029592|A|B|TCP|54|57598  >  20000 [ACK] Seq=1 Ack=1 Win=263424 Len=0|
|9|0.029595|B|A|TCP|66|20000  >  57600 [SYN, ACK] Seq=0 Ack=1 Win=8192 Len=0 MSS=1440 WS=256 SACK_PERM=1|
|10|0.029595|B|A|TCP|66|20000  >  57603 [SYN, ACK] Seq=0 Ack=1 Win=8192 Len=0 MSS=1440 WS=256 SACK_PERM=1|
|11|0.029620|A|B|TCP|54|57600  >  20000 [ACK] Seq=1 Ack=1 Win=263424 Len=0|
|12|0.029624|A|B|TCP|54|57603  >  20000 [ACK] Seq=1 Ack=1 Win=263424 Len=0|
|13|0.029853|A|B|TLSv1|571|Client Hello|
|14|0.029953|A|B|TLSv1|571|Client Hello|
|15|0.030040|A|B|TLSv1|571|Client Hello|
|16|0.030450|B|A|TCP|66|20000  >  57601 [SYN, ACK] Seq=0 Ack=1 Win=8192 Len=0 MSS=1440 WS=256 SACK_PERM=1|
|17|0.030451|B|A|TCP|66|20000  >  57602 [SYN, ACK] Seq=0 Ack=1 Win=8192 Len=0 MSS=1440 WS=256 SACK_PERM=1|
|18|0.030473|B|A|TCP|66|20000  >  57599 [SYN, ACK] Seq=0 Ack=1 Win=8192 Len=0 MSS=1440 WS=256 SACK_PERM=1|
|19|0.030477|A|B|TCP|54|57601  >  20000 [ACK] Seq=1 Ack=1 Win=263424 Len=0|
|20|0.030480|A|B|TCP|54|57602  >  20000 [ACK] Seq=1 Ack=1 Win=263424 Len=0|
|21|0.030494|A|B|TCP|54|57599  >  20000 [ACK] Seq=1 Ack=1 Win=263424 Len=0|
|22|0.030661|A|B|TLSv1.2|571|Client Hello|
|23|0.030753|A|B|TLSv1.2|571|Client Hello|
|24|0.030839|A|B|TLSv1|571|Client Hello|
|25|0.059177|B|A|TCP|198|20000  >  57598 [PSH, ACK] Seq=1 Ack=518 Win=262656 Len=144 [TCP segment of a reassembled PDU]|
|26|0.059206|B|A|TCP|198|20000  >  57603 [PSH, ACK] Seq=1 Ack=518 Win=262656 Len=144 [TCP segment of a reassembled PDU]|
|27|0.059206|B|A|TCP|60|20000  >  57603 [FIN, ACK] Seq=145 Ack=518 Win=262656 Len=0|
|28|0.059225|A|B|TCP|54|57603  >  20000 [ACK] Seq=518 Ack=146 Win=263168 Len=0|
|29|0.059332|A|B|TLSv1|61|Alert (Level: Fatal, Description: Protocol Version)|
|30|0.059383|A|B|TCP|54|57603  >  20000 [FIN, ACK] Seq=525 Ack=146 Win=263168 Len=0|
|31|0.059542|A|B|TCP|66|57604  >  20000 [SYN] Seq=0 Win=64240 Len=0 MSS=1460 WS=256 SACK_PERM=1|
|32|0.059585|A|B|TLSv1|61|Alert (Level: Fatal, Description: Protocol Version)|
|33|0.059616|A|B|TCP|54|57598  >  20000 [FIN, ACK] Seq=525 Ack=145 Win=263168 Len=0|
|34|0.059646|B|A|TCP|60|20000  >  57598 [FIN, ACK] Seq=145 Ack=518 Win=262656 Len=0|
|35|0.059660|A|B|TCP|54|57598  >  20000 [ACK] Seq=526 Ack=146 Win=263168 Len=0|
|36|0.059677|B|A|TCP|198|20000  >  57600 [PSH, ACK] Seq=1 Ack=518 Win=262656 Len=144 [TCP segment of a reassembled PDU]|
|37|0.059677|B|A|TCP|60|20000  >  57600 [FIN, ACK] Seq=145 Ack=518 Win=262656 Len=0|
|38|0.059694|A|B|TCP|54|57600  >  20000 [ACK] Seq=518 Ack=146 Win=263168 Len=0|
|39|0.059742|A|B|TCP|66|57605  >  20000 [SYN] Seq=0 Win=64240 Len=0 MSS=1460 WS=256 SACK_PERM=1|
|40|0.059789|A|B|TLSv1|61|Alert (Level: Fatal, Description: Protocol Version)|
|41|0.060157|B|A|TCP|198|20000  >  57601 [PSH, ACK] Seq=1 Ack=1 Win=262656 Len=144 [TCP segment of a reassembled PDU]|
|42|0.060198|A|B|TCP|54|57600  >  20000 [FIN, ACK] Seq=525 Ack=146 Win=263168 Len=0|
|43|0.060323|A|B|TCP|66|57606  >  20000 [SYN] Seq=0 Win=64240 Len=0 MSS=1460 WS=256 SACK_PERM=1|
|44|0.060467|A|B|TCP|66|57607  >  20000 [SYN] Seq=0 Win=64240 Len=0 MSS=1460 WS=256 SACK_PERM=1|
|45|0.060582|A|B|TCP|66|57608  >  20000 [SYN] Seq=0 Win=64240 Len=0 MSS=1460 WS=256 SACK_PERM=1|
|46|0.060616|A|B|TLSv1|61|Alert (Level: Fatal, Description: Protocol Version)|
|47|0.060642|A|B|TCP|54|57601  >  20000 [FIN, ACK] Seq=525 Ack=145 Win=263168 Len=0|
|48|0.060722|A|B|TCP|66|57609  >  20000 [SYN] Seq=0 Win=64240 Len=0 MSS=1460 WS=256 SACK_PERM=1|
|49|0.060832|A|B|TCP|66|57610  >  20000 [SYN] Seq=0 Win=64240 Len=0 MSS=1460 WS=256 SACK_PERM=1|
|50|0.060940|A|B|TCP|66|57611  >  20000 [SYN] Seq=0 Win=64240 Len=0 MSS=1460 WS=256 SACK_PERM=1|
|51|0.061376|B|A|TCP|60|20000  >  57601 [FIN, ACK] Seq=145 Ack=518 Win=262144 Len=0|
|52|0.061388|A|B|TCP|54|57601  >  20000 [ACK] Seq=526 Ack=146 Win=263168 Len=0|
|53|0.062371|B|A|TLSv1.2|210|Server Hello, Change Cipher Spec, Encrypted Handshake Message|
|54|0.062372|B|A|TLSv1.2|210|Server Hello, Change Cipher Spec, Encrypted Handshake Message|
|55|0.063042|A|B|TLSv1.2|105|Change Cipher Spec, Encrypted Handshake Message|
|56|0.063451|A|B|TLSv1.2|105|Change Cipher Spec, Encrypted Handshake Message|
|57|0.063518|A|B|TLSv1.2|605|Application Data|
|58|0.063558|A|B|TLSv1.2|611|Application Data|
|59|0.088595|B|A|TCP|66|20000  >  57604 [SYN, ACK] Seq=0 Ack=1 Win=8192 Len=0 MSS=1440 WS=256 SACK_PERM=1|
|60|0.088596|B|A|TCP|60|20000  >  57598 [RST, ACK] Seq=146 Ack=525 Win=0 Len=0|
|61|0.088598|B|A|TCP|60|20000  >  57603 [RST, ACK] Seq=146 Ack=525 Win=0 Len=0|
|62|0.088632|A|B|TCP|54|57604  >  20000 [ACK] Seq=1 Ack=1 Win=263424 Len=0|
|63|0.088890|A|B|TLSv1|571|Client Hello|
|64|0.089569|B|A|TCP|66|20000  >  57605 [SYN, ACK] Seq=0 Ack=1 Win=8192 Len=0 MSS=1440 WS=256 SACK_PERM=1|
|65|0.089590|A|B|TCP|54|57605  >  20000 [ACK] Seq=1 Ack=1 Win=263424 Len=0|
|66|0.089614|B|A|TCP|60|20000  >  57600 [RST, ACK] Seq=146 Ack=525 Win=0 Len=0|
|67|0.089730|A|B|TLSv1|571|Client Hello|
|68|0.090235|B|A|TCP|66|20000  >  57606 [SYN, ACK] Seq=0 Ack=1 Win=8192 Len=0 MSS=1440 WS=256 SACK_PERM=1|
|69|0.090250|A|B|TCP|54|57606  >  20000 [ACK] Seq=1 Ack=1 Win=263424 Len=0|
|70|0.090470|A|B|TLSv1.2|571|Client Hello|
|71|0.091016|B|A|TCP|66|20000  >  57608 [SYN, ACK] Seq=0 Ack=1 Win=8192 Len=0 MSS=1440 WS=256 SACK_PERM=1|
|72|0.091051|B|A|TCP|60|20000  >  57601 [RST, ACK] Seq=146 Ack=525 Win=0 Len=0|
|73|0.091052|B|A|TCP|66|20000  >  57607 [SYN, ACK] Seq=0 Ack=1 Win=8192 Len=0 MSS=1440 WS=256 SACK_PERM=1|
|74|0.091052|B|A|TCP|66|20000  >  57610 [SYN, ACK] Seq=0 Ack=1 Win=8192 Len=0 MSS=1440 WS=256 SACK_PERM=1|
|75|0.091053|A|B|TCP|54|57608  >  20000 [ACK] Seq=1 Ack=1 Win=263424 Len=0|
|76|0.091077|A|B|TCP|54|57607  >  20000 [ACK] Seq=1 Ack=1 Win=263424 Len=0|
|77|0.091081|A|B|TCP|54|57610  >  20000 [ACK] Seq=1 Ack=1 Win=263424 Len=0|
|78|0.091204|A|B|TLSv1.2|260|Client Hello|
|79|0.091254|A|B|TLSv1|260|Client Hello|
|80|0.091314|A|B|TLSv1|260|Client Hello|
|81|0.092040|B|A|TCP|66|20000  >  57611 [SYN, ACK] Seq=0 Ack=1 Win=8192 Len=0 MSS=1440 WS=256 SACK_PERM=1|
|82|0.092056|A|B|TCP|54|57611  >  20000 [ACK] Seq=1 Ack=1 Win=263424 Len=0|
|83|0.092074|B|A|TCP|66|20000  >  57609 [SYN, ACK] Seq=0 Ack=1 Win=8192 Len=0 MSS=1440 WS=256 SACK_PERM=1|
|84|0.092090|A|B|TCP|54|57609  >  20000 [ACK] Seq=1 Ack=1 Win=263424 Len=0|
|85|0.092256|A|B|TLSv1|571|Client Hello|
|86|0.092308|A|B|TLSv1|260|Client Hello|
|87|0.094354|B|A|TCP|60|20000  >  57602 [ACK] Seq=157 Ack=1126 Win=262144 Len=0|
|88|0.094355|B|A|TLSv1.2|387|Application Data|
|89|0.094367|B|A|TCP|60|20000  >  57599 [ACK] Seq=157 Ack=1120 Win=262144 Len=0|
|90|0.094367|B|A|TLSv1.2|387|Application Data|
|91|0.095703|A|B|TLSv1.2|611|Application Data|
|92|0.095769|A|B|TLSv1.2|614|Application Data|
|93|0.118815|B|A|TCP|198|20000  >  57605 [PSH, ACK] Seq=1 Ack=518 Win=262656 Len=144 [TCP segment of a reassembled PDU]|
|94|0.118816|B|A|TCP|60|20000  >  57605 [FIN, ACK] Seq=145 Ack=518 Win=262656 Len=0|
|95|0.118845|B|A|TCP|198|20000  >  57604 [PSH, ACK] Seq=1 Ack=518 Win=262656 Len=144 [TCP segment of a reassembled PDU]|
|96|0.118864|B|A|TCP|60|20000  >  57604 [FIN, ACK] Seq=145 Ack=518 Win=262656 Len=0|
|97|0.118870|A|B|TCP|54|57605  >  20000 [ACK] Seq=518 Ack=146 Win=263168 Len=0|
|98|0.118881|A|B|TCP|54|57604  >  20000 [ACK] Seq=518 Ack=146 Win=263168 Len=0|
|99|0.119007|A|B|TLSv1|61|Alert (Level: Fatal, Description: Protocol Version)|
|100|0.119056|A|B|TCP|54|57605  >  20000 [FIN, ACK] Seq=525 Ack=146 Win=263168 Len=0|
|101|0.119228|A|B|TCP|66|57612  >  20000 [SYN] Seq=0 Win=64240 Len=0 MSS=1460 WS=256 SACK_PERM=1|
|102|0.119275|A|B|TLSv1|61|Alert (Level: Fatal, Description: Protocol Version)|
|103|0.119329|A|B|TCP|54|57604  >  20000 [FIN, ACK] Seq=525 Ack=146 Win=263168 Len=0|
|104|0.119564|A|B|TCP|66|57613  >  20000 [SYN] Seq=0 Win=64240 Len=0 MSS=1460 WS=256 SACK_PERM=1|
|105|0.119774|A|B|TCP|66|57614  >  20000 [SYN] Seq=0 Win=64240 Len=0 MSS=1460 WS=256 SACK_PERM=1|
|106|0.120914|B|A|TLSv1.2|210|Server Hello, Change Cipher Spec, Encrypted Handshake Message|
|107|0.121489|A|B|TLSv1.2|105|Change Cipher Spec, Encrypted Handshake Message|
|108|0.121535|B|A|TCP|198|20000  >  57608 [PSH, ACK] Seq=1 Ack=207 Win=262656 Len=144 [TCP segment of a reassembled PDU]|
|109|0.121535|B|A|TCP|60|20000  >  57608 [FIN, ACK] Seq=145 Ack=207 Win=262656 Len=0|
|110|0.121572|A|B|TCP|54|57608  >  20000 [ACK] Seq=207 Ack=146 Win=263168 Len=0|
|111|0.121617|A|B|TLSv1.2|616|Application Data|
|112|0.121671|A|B|TLSv1|61|Alert (Level: Fatal, Description: Protocol Version)|
|113|0.121702|A|B|TCP|54|57608  >  20000 [FIN, ACK] Seq=214 Ack=146 Win=263168 Len=0|
|114|0.122033|B|A|TCP|198|20000  >  57607 [PSH, ACK] Seq=1 Ack=207 Win=262656 Len=144 [TCP segment of a reassembled PDU]|
|115|0.122033|B|A|TCP|60|20000  >  57607 [FIN, ACK] Seq=145 Ack=207 Win=262656 Len=0|
|116|0.122055|A|B|TCP|54|57607  >  20000 [ACK] Seq=207 Ack=146 Win=263168 Len=0|
|117|0.122202|A|B|TLSv1|61|Alert (Level: Fatal, Description: Protocol Version)|
|118|0.122234|A|B|TCP|54|57607  >  20000 [FIN, ACK] Seq=214 Ack=146 Win=263168 Len=0|
|119|0.123147|B|A|TCP|198|20000  >  57611 [PSH, ACK] Seq=1 Ack=207 Win=262656 Len=144 [TCP segment of a reassembled PDU]|
|120|0.123203|B|A|TCP|1514|20000  >  57610 [ACK] Seq=1 Ack=207 Win=262656 Len=1460 [TCP segment of a reassembled PDU]|
|121|0.123205|B|A|TCP|1514|20000  >  57610 [ACK] Seq=1461 Ack=207 Win=262656 Len=1460 [TCP segment of a reassembled PDU]|
|122|0.123205|B|A|TCP|1514|20000  >  57610 [ACK] Seq=2921 Ack=207 Win=262656 Len=1460 [TCP segment of a reassembled PDU]|
|123|0.123205|B|A|TLSv1.2|773|Server Hello, Certificate, Certificate Status, Server Key Exchange, Server Hello Done|
|124|0.123228|A|B|TCP|54|57610  >  20000 [ACK] Seq=207 Ack=5100 Win=263424 Len=0|
|125|0.123271|A|B|TLSv1|61|Alert (Level: Fatal, Description: Protocol Version)|
|126|0.123298|A|B|TCP|54|57611  >  20000 [FIN, ACK] Seq=214 Ack=145 Win=263168 Len=0|
|127|0.123822|A|B|TLSv1.2|147|Client Key Exchange, Change Cipher Spec, Encrypted Handshake Message|
|128|0.123839|A|B|TCP|54|57610  >  20000 [FIN, ACK] Seq=300 Ack=5100 Win=263424 Len=0|
|129|0.124242|B|A|TCP|198|20000  >  57609 [PSH, ACK] Seq=1 Ack=518 Win=262656 Len=144 [TCP segment of a reassembled PDU]|
|130|0.124242|B|A|TCP|60|20000  >  57609 [FIN, ACK] Seq=145 Ack=518 Win=262656 Len=0|
|131|0.124274|A|B|TCP|54|57609  >  20000 [ACK] Seq=518 Ack=146 Win=263168 Len=0|
|132|0.124353|A|B|TLSv1|61|Alert (Level: Fatal, Description: Protocol Version)|
|133|0.124383|A|B|TCP|54|57609  >  20000 [FIN, ACK] Seq=525 Ack=146 Win=263168 Len=0|
|134|0.124578|A|B|TCP|66|57615  >  20000 [SYN] Seq=0 Win=64240 Len=0 MSS=1460 WS=256 SACK_PERM=1|
|135|0.125255|B|A|TCP|60|20000  >  57611 [FIN, ACK] Seq=145 Ack=207 Win=262656 Len=0|
|136|0.125265|A|B|TCP|54|57611  >  20000 [ACK] Seq=215 Ack=146 Win=263168 Len=0|
|137|0.126995|B|A|TLSv1.2|387|Application Data|
|138|0.127024|B|A|TLSv1.2|387|Application Data|
|139|0.127950|A|B|TLSv1.2|1578|Application Data|
|140|0.141301|A|B|TLSv1.2|1587|Application Data|
|141|0.148468|B|A|TCP|60|20000  >  57604 [RST, ACK] Seq=146 Ack=525 Win=0 Len=0|
|142|0.148470|B|A|TCP|60|20000  >  57605 [RST, ACK] Seq=146 Ack=525 Win=0 Len=0|
|143|0.148931|B|A|TCP|66|20000  >  57614 [SYN, ACK] Seq=0 Ack=1 Win=8192 Len=0 MSS=1440 WS=256 SACK_PERM=1|
|144|0.148962|A|B|TCP|54|57614  >  20000 [ACK] Seq=1 Ack=1 Win=263424 Len=0|
|145|0.149107|A|B|TLSv1.2|260|Client Hello|
|146|0.149950|B|A|TCP|66|20000  >  57613 [SYN, ACK] Seq=0 Ack=1 Win=8192 Len=0 MSS=1440 WS=256 SACK_PERM=1|
|147|0.149981|A|B|TCP|54|57613  >  20000 [ACK] Seq=1 Ack=1 Win=263424 Len=0|
|148|0.150127|A|B|TLSv1|260|Client Hello|
|149|0.150577|B|A|TCP|66|20000  >  57612 [SYN, ACK] Seq=0 Ack=1 Win=8192 Len=0 MSS=1440 WS=256 SACK_PERM=1|
|150|0.150610|A|B|TCP|54|57612  >  20000 [ACK] Seq=1 Ack=1 Win=263424 Len=0|
|151|0.150747|A|B|TLSv1|571|Client Hello|
|152|0.151031|B|A|TCP|60|20000  >  57606 [ACK] Seq=157 Ack=1131 Win=262144 Len=0|
|153|0.151075|B|A|TLSv1.2|387|Application Data|
|154|0.152182|B|A|TCP|60|20000  >  57608 [RST, ACK] Seq=146 Ack=214 Win=0 Len=0|
|155|0.152453|A|B|TLSv1.2|1589|Application Data|
|156|0.152904|B|A|TCP|60|20000  >  57607 [RST, ACK] Seq=146 Ack=214 Win=0 Len=0|
|157|0.153939|B|A|TCP|60|20000  >  57611 [RST, ACK] Seq=146 Ack=214 Win=0 Len=0|
|158|0.153957|B|A|TCP|66|20000  >  57615 [SYN, ACK] Seq=0 Ack=1 Win=8192 Len=0 MSS=1440 WS=256 SACK_PERM=1|
|159|0.154060|A|B|TCP|54|57615  >  20000 [ACK] Seq=1 Ack=1 Win=263424 Len=0|
|160|0.154069|B|A|TCP|60|20000  >  57610 [ACK] Seq=5100 Ack=301 Win=262656 Len=0|
|161|0.154139|A|B|TLSv1|260|Client Hello|
|162|0.155062|B|A|TLSv1.2|105|Change Cipher Spec, Encrypted Handshake Message|
|163|0.155062|B|A|TCP|60|20000  >  57610 [FIN, ACK] Seq=5151 Ack=301 Win=262656 Len=0|
|164|0.155073|A|B|TCP|54|57610  >  20000 [RST, ACK] Seq=301 Ack=5151 Win=0 Len=0|
|165|0.155433|B|A|TCP|60|20000  >  57609 [RST, ACK] Seq=146 Ack=525 Win=0 Len=0|
|166|0.159026|B|A|TCP|60|20000  >  57602 [ACK] Seq=823 Ack=3210 Win=262656 Len=0|
|167|0.172938|B|A|TCP|60|20000  >  57599 [ACK] Seq=823 Ack=3210 Win=262656 Len=0|
|168|0.174561|B|A|TCP|1514|20000  >  57602 [ACK] Seq=823 Ack=3210 Win=262656 Len=1460 [TCP segment of a reassembled PDU]|
|169|0.174564|B|A|TLSv1.2|369|Application Data, Application Data|
|170|0.174594|A|B|TCP|54|57602  >  20000 [ACK] Seq=3210 Ack=2598 Win=263424 Len=0|
|171|0.180298|A|B|TLSv1.2|608|Application Data|
|172|0.180435|B|A|TCP|1514|20000  >  57614 [ACK] Seq=1 Ack=207 Win=262656 Len=1460 [TCP segment of a reassembled PDU]|
|173|0.180435|B|A|TCP|1514|20000  >  57614 [ACK] Seq=1461 Ack=207 Win=262656 Len=1460 [TCP segment of a reassembled PDU]|
|174|0.180465|A|B|TCP|54|57614  >  20000 [ACK] Seq=207 Ack=2921 Win=263424 Len=0|
|175|0.180477|B|A|TCP|1514|20000  >  57614 [ACK] Seq=2921 Ack=207 Win=262656 Len=1460 [TCP segment of a reassembled PDU]|
|176|0.180478|B|A|TLSv1.2|773|Server Hello, Certificate, Certificate Status, Server Key Exchange, Server Hello Done|
|177|0.180478|B|A|TCP|198|20000  >  57613 [PSH, ACK] Seq=1 Ack=1 Win=262656 Len=144 [TCP segment of a reassembled PDU]|
|178|0.180493|A|B|TCP|54|57614  >  20000 [ACK] Seq=207 Ack=5100 Win=263424 Len=0|
|179|0.180549|A|B|TLSv1|61|Alert (Level: Fatal, Description: Protocol Version)|
|180|0.180596|B|A|TLSv1.2|641|Application Data|
|181|0.180597|B|A|TLSv1.2|88|Application Data|
|182|0.180601|A|B|TCP|54|57613  >  20000 [FIN, ACK] Seq=214 Ack=145 Win=263168 Len=0|
|183|0.180601|B|A|TCP|60|20000  >  57613 [FIN, ACK] Seq=145 Ack=207 Win=262400 Len=0|
|184|0.180614|A|B|TCP|54|57599  >  20000 [ACK] Seq=3210 Ack=1444 Win=263424 Len=0|
|185|0.180616|A|B|TCP|54|57613  >  20000 [ACK] Seq=215 Ack=146 Win=263168 Len=0|
|186|0.181214|A|B|TLSv1.2|147|Client Key Exchange, Change Cipher Spec, Encrypted Handshake Message|
|187|0.181229|A|B|TCP|54|57614  >  20000 [FIN, ACK] Seq=300 Ack=5100 Win=263424 Len=0|
|188|0.181940|A|B|TCP|66|57616  >  20000 [SYN] Seq=0 Win=64240 Len=0 MSS=1460 WS=256 SACK_PERM=1|
|189|0.182175|B|A|TCP|60|20000  >  57606 [ACK] Seq=490 Ack=2666 Win=262656 Len=0|
|190|0.182337|A|B|TLSv1.2|601|Application Data|
|191|0.182764|B|A|TCP|198|20000  >  57612 [PSH, ACK] Seq=1 Ack=518 Win=262656 Len=144 [TCP segment of a reassembled PDU]|
|192|0.182764|B|A|TCP|60|20000  >  57612 [FIN, ACK] Seq=145 Ack=518 Win=262656 Len=0|
|193|0.182787|A|B|TCP|54|57612  >  20000 [ACK] Seq=518 Ack=146 Win=263168 Len=0|
|194|0.182828|A|B|TLSv1|61|Alert (Level: Fatal, Description: Protocol Version)|
|195|0.182873|A|B|TCP|54|57612  >  20000 [FIN, ACK] Seq=525 Ack=146 Win=263168 Len=0|
|196|0.183801|B|A|TCP|198|20000  >  57615 [PSH, ACK] Seq=1 Ack=207 Win=262656 Len=144 [TCP segment of a reassembled PDU]|
|197|0.183801|B|A|TCP|60|20000  >  57615 [FIN, ACK] Seq=145 Ack=207 Win=262656 Len=0|
|198|0.183818|A|B|TCP|54|57615  >  20000 [ACK] Seq=207 Ack=146 Win=263168 Len=0|
|199|0.183879|A|B|TCP|66|57617  >  20000 [SYN] Seq=0 Win=64240 Len=0 MSS=1460 WS=256 SACK_PERM=1|
|200|0.183920|A|B|TLSv1|61|Alert (Level: Fatal, Description: Protocol Version)|
|201|0.183948|A|B|TCP|54|57615  >  20000 [FIN, ACK] Seq=214 Ack=146 Win=263168 Len=0|
|202|0.184206|A|B|TCP|66|57618  >  20000 [SYN] Seq=0 Win=64240 Len=0 MSS=1460 WS=256 SACK_PERM=1|
|203|0.192728|B|A|TLSv1.2|397|Application Data|
|204|0.192729|B|A|TLSv1.2|88|Application Data|
|205|0.192756|A|B|TCP|54|57606  >  20000 [ACK] Seq=2666 Ack=867 Win=262400 Len=0|
|206|0.193448|A|B|TLSv1.2|621|Application Data|
|207|0.210999|B|A|TLSv1.2|387|Application Data|
|208|0.211011|B|A|TCP|60|20000  >  57614 [ACK] Seq=5100 Ack=301 Win=262656 Len=0|
|209|0.211591|A|B|TLSv1.2|1584|Application Data|
|210|0.212025|B|A|TLSv1.2|105|Change Cipher Spec, Encrypted Handshake Message|
|211|0.212026|B|A|TCP|60|20000  >  57614 [FIN, ACK] Seq=5151 Ack=301 Win=262656 Len=0|
|212|0.212044|A|B|TCP|54|57614  >  20000 [RST, ACK] Seq=301 Ack=5151 Win=0 Len=0|
|213|0.212829|B|A|TCP|66|20000  >  57616 [SYN, ACK] Seq=0 Ack=1 Win=8192 Len=0 MSS=1440 WS=256 SACK_PERM=1|
|214|0.212856|A|B|TCP|54|57616  >  20000 [ACK] Seq=1 Ack=1 Win=263424 Len=0|
|215|0.213048|A|B|TLSv1|571|Client Hello|
|216|0.213929|B|A|TCP|60|20000  >  57615 [RST, ACK] Seq=146 Ack=214 Win=0 Len=0|
|217|0.213931|B|A|TLSv1.2|387|Application Data|
|218|0.213974|B|A|TCP|60|20000  >  57613 [RST, ACK] Seq=146 Ack=214 Win=0 Len=0|
|219|0.214403|A|B|TLSv1.2|621|Application Data|
|220|0.214406|B|A|TCP|66|20000  >  57617 [SYN, ACK] Seq=0 Ack=1 Win=8192 Len=0 MSS=1440 WS=256 SACK_PERM=1|
|221|0.214434|A|B|TCP|54|57617  >  20000 [ACK] Seq=1 Ack=1 Win=263424 Len=0|
|222|0.214448|B|A|TCP|60|20000  >  57612 [RST, ACK] Seq=146 Ack=525 Win=0 Len=0|
|223|0.214571|A|B|TLSv1|571|Client Hello|
|224|0.215721|B|A|TCP|66|20000  >  57618 [SYN, ACK] Seq=0 Ack=1 Win=8192 Len=0 MSS=1440 WS=256 SACK_PERM=1|
|225|0.215763|A|B|TCP|54|57618  >  20000 [ACK] Seq=1 Ack=1 Win=263424 Len=0|
|226|0.216005|A|B|TLSv1.2|571|Client Hello|
|227|0.225060|B|A|TLSv1.2|387|Application Data|
|228|0.225681|A|B|TLSv1.2|617|Application Data|
|229|0.242438|B|A|TCP|60|20000  >  57602 [ACK] Seq=2931 Ack=5294 Win=262656 Len=0|
|230|0.243480|B|A|TCP|198|20000  >  57616 [PSH, ACK] Seq=1 Ack=518 Win=262656 Len=144 [TCP segment of a reassembled PDU]|
|231|0.243480|B|A|TCP|60|20000  >  57616 [FIN, ACK] Seq=145 Ack=518 Win=262656 Len=0|
|232|0.243502|A|B|TCP|54|57616  >  20000 [ACK] Seq=518 Ack=146 Win=263168 Len=0|
|233|0.243562|A|B|TLSv1|61|Alert (Level: Fatal, Description: Protocol Version)|
|234|0.243606|A|B|TCP|54|57616  >  20000 [FIN, ACK] Seq=525 Ack=146 Win=263168 Len=0|
|235|0.243758|A|B|TCP|66|57619  >  20000 [SYN] Seq=0 Win=64240 Len=0 MSS=1460 WS=256 SACK_PERM=1|
|236|0.243914|A|B|TCP|66|57620  >  20000 [SYN] Seq=0 Win=64240 Len=0 MSS=1460 WS=256 SACK_PERM=1|
|237|0.244731|B|A|TCP|198|20000  >  57617 [PSH, ACK] Seq=1 Ack=1 Win=262656 Len=144 [TCP segment of a reassembled PDU]|
|238|0.244761|B|A|TLSv1.2|387|Application Data|
|239|0.244953|B|A|TCP|60|20000  >  57617 [FIN, ACK] Seq=145 Ack=518 Win=262144 Len=0|
|240|0.244965|A|B|TCP|54|57617  >  20000 [ACK] Seq=518 Ack=146 Win=263168 Len=0|
|241|0.245210|A|B|TLSv1|61|Alert (Level: Fatal, Description: Protocol Version)|
|242|0.245249|A|B|TCP|54|57617  >  20000 [FIN, ACK] Seq=525 Ack=146 Win=263168 Len=0|
|243|0.245345|A|B|TLSv1.2|621|Application Data|
|244|0.245523|A|B|TCP|66|57621  >  20000 [SYN] Seq=0 Win=64240 Len=0 MSS=1460 WS=256 SACK_PERM=1|
|245|0.246460|A|B|TCP|66|57622  >  20000 [SYN] Seq=0 Win=64240 Len=0 MSS=1460 WS=256 SACK_PERM=1|
|246|0.247223|B|A|TLSv1.2|210|Server Hello, Change Cipher Spec, Encrypted Handshake Message|
|247|0.247988|A|B|TLSv1.2|105|Change Cipher Spec, Encrypted Handshake Message|
|248|0.248115|A|B|TLSv1.2|1574|Application Data|
|249|0.251370|B|A|TLSv1.2|397|Application Data|
|250|0.251619|B|A|TLSv1.2|88|Application Data|
|251|0.251631|A|B|TCP|54|57602  >  20000 [ACK] Seq=5294 Ack=3308 Win=262656 Len=0|
|252|0.251998|A|B|TLSv1.2|1594|Application Data|
|253|0.255035|B|A|TLSv1.2|387|Application Data|
|254|0.255594|A|B|TLSv1.2|1594|Application Data|
|255|0.273503|B|A|TCP|60|20000  >  57616 [RST, ACK] Seq=146 Ack=525 Win=0 Len=0|
|256|0.273504|B|A|TCP|66|20000  >  57619 [SYN, ACK] Seq=0 Ack=1 Win=8192 Len=0 MSS=1440 WS=256 SACK_PERM=1|
|257|0.273565|A|B|TCP|54|57619  >  20000 [ACK] Seq=1 Ack=1 Win=263424 Len=0|
|258|0.273856|A|B|TLSv1|571|Client Hello|
|259|0.274215|B|A|TCP|66|20000  >  57620 [SYN, ACK] Seq=0 Ack=1 Win=8192 Len=0 MSS=1440 WS=256 SACK_PERM=1|
|260|0.274239|A|B|TCP|54|57620  >  20000 [ACK] Seq=1 Ack=1 Win=263424 Len=0|
|261|0.274419|A|B|TLSv1|260|Client Hello|
|262|0.275294|B|A|TCP|66|20000  >  57621 [SYN, ACK] Seq=0 Ack=1 Win=8192 Len=0 MSS=1440 WS=256 SACK_PERM=1|
|263|0.275296|B|A|TCP|60|20000  >  57617 [RST, ACK] Seq=146 Ack=525 Win=0 Len=0|
|264|0.275346|A|B|TCP|54|57621  >  20000 [ACK] Seq=1 Ack=1 Win=263424 Len=0|
|265|0.275594|B|A|TCP|66|20000  >  57622 [SYN, ACK] Seq=0 Ack=1 Win=8192 Len=0 MSS=1440 WS=256 SACK_PERM=1|
|266|0.275595|B|A|TLSv1.2|387|Application Data|
|267|0.275604|A|B|TLSv1|260|Client Hello|
|268|0.275629|A|B|TCP|54|57622  >  20000 [ACK] Seq=1 Ack=1 Win=263424 Len=0|
|269|0.276473|A|B|TLSv1.2|571|Client Hello|
|270|0.276573|A|B|TLSv1.2|1590|Application Data|
|271|0.278895|B|A|TCP|60|20000  >  57618 [ACK] Seq=157 Ack=2089 Win=262656 Len=0|
|272|0.282125|B|A|TCP|60|20000  >  57602 [ACK] Seq=3308 Ack=6834 Win=262656 Len=0|
|273|0.285177|B|A|TCP|60|20000  >  57606 [ACK] Seq=1533 Ack=5336 Win=262656 Len=0|
|274|0.295322|B|A|TLSv1.2|431|Application Data, Application Data|
|275|0.296229|A|B|TLSv1.2|1594|Application Data|
|276|0.303632|B|A|TCP|198|20000  >  57619 [PSH, ACK] Seq=1 Ack=518 Win=262656 Len=144 [TCP segment of a reassembled PDU]|
|277|0.303633|B|A|TCP|60|20000  >  57619 [FIN, ACK] Seq=145 Ack=518 Win=262656 Len=0|
|278|0.303660|A|B|TCP|54|57619  >  20000 [ACK] Seq=518 Ack=146 Win=263168 Len=0|
|279|0.303759|A|B|TLSv1|61|Alert (Level: Fatal, Description: Protocol Version)|
|280|0.303797|A|B|TCP|54|57619  >  20000 [FIN, ACK] Seq=525 Ack=146 Win=263168 Len=0|
|281|0.304304|B|A|TCP|198|20000  >  57620 [PSH, ACK] Seq=1 Ack=207 Win=262656 Len=144 [TCP segment of a reassembled PDU]|
|282|0.304421|B|A|TCP|60|20000  >  57620 [FIN, ACK] Seq=145 Ack=207 Win=262656 Len=0|
|283|0.304429|A|B|TCP|54|57620  >  20000 [ACK] Seq=207 Ack=146 Win=263168 Len=0|
|284|0.304450|A|B|TLSv1|61|Alert (Level: Fatal, Description: Protocol Version)|
|285|0.304479|A|B|TCP|54|57620  >  20000 [FIN, ACK] Seq=214 Ack=146 Win=263168 Len=0|
|286|0.305124|B|A|TCP|198|20000  >  57621 [PSH, ACK] Seq=1 Ack=1 Win=262656 Len=144 [TCP segment of a reassembled PDU]|
|287|0.305195|A|B|TLSv1|61|Alert (Level: Fatal, Description: Protocol Version)|
|288|0.305223|A|B|TCP|54|57621  >  20000 [FIN, ACK] Seq=214 Ack=145 Win=263168 Len=0|
|289|0.305350|B|A|TCP|60|20000  >  57621 [FIN, ACK] Seq=145 Ack=207 Win=262400 Len=0|
|290|0.305360|A|B|TCP|54|57621  >  20000 [ACK] Seq=215 Ack=146 Win=263168 Len=0|
|291|0.305553|B|A|TLSv1.2|210|Server Hello, Change Cipher Spec, Encrypted Handshake Message|
|292|0.306035|A|B|TLSv1.2|105|Change Cipher Spec, Encrypted Handshake Message|
|293|0.306469|B|A|TCP|60|20000  >  57599 [ACK] Seq=2443 Ack=6427 Win=262656 Len=0|
|294|0.308397|B|A|TLSv1.2|675|Application Data, Application Data|
|295|0.315865|B|A|TCP|1514|20000  >  57618 [ACK] Seq=157 Ack=2089 Win=262656 Len=1460 [TCP segment of a reassembled PDU]|
|296|0.315866|B|A|TCP|1514|20000  >  57618 [ACK] Seq=1617 Ack=2089 Win=262656 Len=1460 [TCP segment of a reassembled PDU]|
|297|0.315867|B|A|TLSv1.2|1514|Application Data [TCP segment of a reassembled PDU]|
|298|0.315867|B|A|TCP|1514|20000  >  57618 [ACK] Seq=4537 Ack=2089 Win=262656 Len=1460 [TCP segment of a reassembled PDU]|
|299|0.315893|A|B|TCP|54|57618  >  20000 [ACK] Seq=2089 Ack=5997 Win=263424 Len=0|
|300|0.315952|B|A|TCP|1514|20000  >  57618 [ACK] Seq=5997 Ack=2089 Win=262656 Len=1460 [TCP segment of a reassembled PDU]|
|301|0.315952|B|A|TLSv1.2|1514|Application Data [TCP segment of a reassembled PDU]|
|302|0.315953|B|A|TCP|1514|20000  >  57618 [ACK] Seq=8917 Ack=2089 Win=262656 Len=1460 [TCP segment of a reassembled PDU]|
|303|0.315953|B|A|TCP|1514|20000  >  57618 [ACK] Seq=10377 Ack=2089 Win=262656 Len=1460 [TCP segment of a reassembled PDU]|
|304|0.315954|B|A|TLSv1.2|1514|Application Data [TCP segment of a reassembled PDU]|
|305|0.315954|B|A|TCP|1514|20000  >  57618 [ACK] Seq=13297 Ack=2089 Win=262656 Len=1460 [TCP segment of a reassembled PDU]|
|306|0.315968|A|B|TCP|54|57618  >  20000 [ACK] Seq=2089 Ack=14757 Win=263424 Len=0|
|307|0.316214|B|A|TLSv1.2|417|Application Data|
|308|0.316215|B|A|TLSv1.2|88|Application Data|
|309|0.316232|A|B|TCP|54|57599  >  20000 [ACK] Seq=6427 Ack=2840 Win=261888 Len=0|
|310|0.324967|B|A|TCP|60|20000  >  57606 [ACK] Seq=1910 Ack=6876 Win=262656 Len=0|
|311|0.332849|B|A|TCP|60|20000  >  57619 [RST, ACK] Seq=146 Ack=525 Win=0 Len=0|
|312|0.334223|B|A|TCP|60|20000  >  57620 [RST, ACK] Seq=146 Ack=214 Win=0 Len=0|
|313|0.334826|B|A|TCP|60|20000  >  57621 [RST, ACK] Seq=146 Ack=214 Win=0 Len=0|
|314|0.335046|B|A|TLSv1.2|397|Application Data|
|315|0.335047|B|A|TLSv1.2|88|Application Data|
|316|0.335063|A|B|TCP|54|57606  >  20000 [ACK] Seq=6876 Ack=2287 Win=262656 Len=0|
|317|0.346679|B|A|TLSv1.2|348|Application Data, Application Data|
|318|0.348341|A|B|TCP|54|57602  >  20000 [ACK] Seq=6834 Ack=3929 Win=262144 Len=0|
|319|0.349583|A|B|TLSv1.2|622|Application Data|
|320|0.380700|B|A|TLSv1.2|387|Application Data|
|321|0.382316|A|B|TLSv1.2|1595|Application Data|
|322|0.387817|B|A|TCP|60|20000  >  57622 [ACK] Seq=157 Ack=569 Win=262656 Len=0|
|323|0.413125|B|A|TCP|60|20000  >  57618 [ACK] Seq=15384 Ack=4198 Win=262656 Len=0|
|324|0.421281|B|A|TLSv1.2|431|Application Data|
|325|0.421281|B|A|TLSv1.2|88|Application Data|
|326|0.421301|A|B|TCP|54|57618  >  20000 [ACK] Seq=4198 Ack=15795 Win=262400 Len=0|
